{
  "authorization_decision_id": "authz-demo-allowed-0001",
  "tool_action_request_id": "tar-demo-allowed-0001",
  "decided_at": "2026-05-02T10:00:10Z",
  "expires_at": "2026-05-02T10:10:10Z",
  "decision": "allow",
  "action_type": "tool_execution",
  "target_id": "webapp-demo-001",
  "scope_id": "scope-demo-001",
  "tool": "zap",
  "operation": "authenticated_crawl",
  "credential_ref": "test-account-001",
  "constraints": {
    "rate_limit": "low",
    "destructive_tests": false,
    "external_discovery": false,
    "evidence_required": true,
    "max_duration_seconds": 300,
    "allowed_time_window_id": "window-demo-001"
  },
  "human_review_required": false,
  "evidence_required": true,
  "policy_version": "mvp-policy-v0.1",
  "decision_reason": "Approved because target, scope, tool, operation, and credential_ref match MVP policy."
}
